{
  "v": "techlib-1.1",
  "name": "stdcells",
  "minecraft": {
    "version": "1.20",
    "edition": "java",
    "coords": "x-east_y-up_z-south",
    "orientations": ["north", "south", "east", "west", "up", "down"]
  },
  "physics": {
    "tick": 0.05,
    "power_levels": 15
  },
  "cells": [
    {
      "name": "AND2",
      "kind": "COMB",
      "pins": [
        { "name": "A", "dir": "in", "bitwidth": 1 },
        { "name": "B", "dir": "in", "bitwidth": 1 },
        { "name": "Y", "dir": "out", "bitwidth": 1 }
      ],
      "delays": [
        { "from": "A", "to": "Y", "ticks": 1.0 },
        { "from": "B", "to": "Y", "ticks": 1.0 }
      ],
      "footprint": {
        "size": { "x": 1, "y": 1, "z": 1 },
        "voxels": [
          { "block": "minecraft:stone", "state": {}, "x": 0, "y": 0, "z": 0 }
        ],
        "connectors": [
          { "pin": "A", "x": -1, "y": 0, "z": 0, "facing": "east" },
          { "pin": "B", "x": 0, "y": 0, "z": -1, "facing": "south" },
          { "pin": "Y", "x": 1, "y": 0, "z": 0, "facing": "west" }
        ],
        "keepouts": []
      },
      "rotations": ["R0", "R180"]
    }
  ]
}
